{
  "meta": {
    "genre": "heroic_fantasy",
    "world_name": "Erathis",
    "simulation_years": 500,
    "tick_duration_years": 1,
    "seed": 42,
    "chaos_level": 0.4,
    "trope_subversion": 0.6
  },

  "geography": {
    "regions": [
      {
        "id": "reg_plains",
        "name": "Plaines de Valdris",
        "terrain": "fertile",
        "habitability": 0.9,
        "max_population": 500000,
        "resources": ["res_grain", "res_iron"],
        "connections": [
          { "target": "reg_forest", "traversal_difficulty": 0.3 },
          { "target": "reg_coast", "traversal_difficulty": 0.2 }
        ]
      },
      {
        "id": "reg_forest",
        "name": "Forêt d'Ithréal",
        "terrain": "forest_ancient",
        "habitability": 0.6,
        "max_population": 200000,
        "resources": ["res_crystals", "res_wood"],
        "connections": [
          { "target": "reg_plains", "traversal_difficulty": 0.3 },
          { "target": "reg_mountains", "traversal_difficulty": 0.6 }
        ]
      },
      {
        "id": "reg_mountains",
        "name": "Monts de Khar'gul",
        "terrain": "mountainous_arid",
        "habitability": 0.4,
        "max_population": 150000,
        "resources": ["res_iron", "res_gems"],
        "connections": [
          { "target": "reg_forest", "traversal_difficulty": 0.6 },
          { "target": "reg_coast", "traversal_difficulty": 0.5 }
        ]
      },
      {
        "id": "reg_coast",
        "name": "Rivages de Sélène",
        "terrain": "coastal",
        "habitability": 0.7,
        "max_population": 300000,
        "resources": ["res_fish", "res_gems"],
        "connections": [
          { "target": "reg_plains", "traversal_difficulty": 0.2 },
          { "target": "reg_mountains", "traversal_difficulty": 0.5 }
        ]
      }
    ]
  },

  "resources": [
    {
      "id": "res_grain",
      "name": "Céréales",
      "rarity": 0.2,
      "effects": { "fertility": 0.1, "cohesion": 0.05 }
    },
    {
      "id": "res_iron",
      "name": "Fer",
      "rarity": 0.4,
      "effects": { "aggressiveness": 0.1 }
    },
    {
      "id": "res_crystals",
      "name": "Cristaux arcaniques",
      "rarity": 0.8,
      "effects": { "power_affinity": 0.2 }
    },
    {
      "id": "res_wood",
      "name": "Bois ancestral",
      "rarity": 0.3,
      "effects": { "adaptability": 0.1 }
    },
    {
      "id": "res_gems",
      "name": "Pierres précieuses",
      "rarity": 0.6,
      "effects": { "cohesion": 0.1, "expansionism": 0.05 }
    },
    {
      "id": "res_fish",
      "name": "Ressources maritimes",
      "rarity": 0.2,
      "effects": { "fertility": 0.05, "adaptability": 0.05 }
    }
  ],

  "factions": [
    {
      "id": "fac_humans",
      "name": "Royaume de Valdris",
      "governance": "monarchy",
      "avg_lifespan": 70,
      "cultural_traits": ["expansionist", "mercantile", "ruthless", "innovative"],
      "attributes": {
        "aggressiveness": 0.7,
        "cohesion": 0.5,
        "expansionism": 0.8,
        "power_affinity": 0.3,
        "fertility": 0.7,
        "adaptability": 0.8
      }
    },
    {
      "id": "fac_elves",
      "name": "Conseil d'Ithréal",
      "governance": "council",
      "avg_lifespan": 500,
      "cultural_traits": ["isolationist", "scholarly", "arrogant", "ritualistic"],
      "attributes": {
        "aggressiveness": 0.2,
        "cohesion": 0.8,
        "expansionism": 0.2,
        "power_affinity": 0.9,
        "fertility": 0.2,
        "adaptability": 0.4
      }
    },
    {
      "id": "fac_orcs",
      "name": "Clans de Khar'gul",
      "governance": "tribal_chieftain",
      "avg_lifespan": 45,
      "cultural_traits": ["honor_bound", "resilient", "spiritual", "communal"],
      "attributes": {
        "aggressiveness": 0.5,
        "cohesion": 0.7,
        "expansionism": 0.3,
        "power_affinity": 0.2,
        "fertility": 0.8,
        "adaptability": 0.6
      }
    }
  ],

  "tech_tree": {
    "nodes": [
      {
        "id": "tech_agriculture",
        "name": "Agriculture avancée",
        "prerequisites": [],
        "unlock_difficulty": 0.2,
        "effects": { "fertility": 0.1, "max_population_modifier": 1.2 }
      },
      {
        "id": "tech_metallurgy",
        "name": "Métallurgie",
        "prerequisites": [],
        "unlock_difficulty": 0.3,
        "effects": { "aggressiveness": 0.1 }
      },
      {
        "id": "tech_fortification",
        "name": "Fortifications",
        "prerequisites": ["tech_metallurgy"],
        "unlock_difficulty": 0.4,
        "effects": { "cohesion": 0.1, "defense_bonus": 0.3 }
      },
      {
        "id": "tech_arcane_basics",
        "name": "Magie élémentaire",
        "prerequisites": [],
        "unlock_difficulty": 0.5,
        "effects": { "power_affinity": 0.15 }
      },
      {
        "id": "tech_arcane_advanced",
        "name": "Haute sorcellerie",
        "prerequisites": ["tech_arcane_basics"],
        "unlock_difficulty": 0.8,
        "effects": { "power_affinity": 0.25, "defense_bonus": 0.2 }
      },
      {
        "id": "tech_navigation",
        "name": "Navigation maritime",
        "prerequisites": ["tech_agriculture"],
        "unlock_difficulty": 0.4,
        "effects": { "expansionism": 0.15, "adaptability": 0.1 }
      },
      {
        "id": "tech_siege",
        "name": "Engins de siège",
        "prerequisites": ["tech_metallurgy", "tech_fortification"],
        "unlock_difficulty": 0.6,
        "effects": { "aggressiveness": 0.15, "attack_bonus": 0.3 }
      },
      {
        "id": "tech_medicine",
        "name": "Médecine",
        "prerequisites": ["tech_agriculture"],
        "unlock_difficulty": 0.4,
        "effects": { "fertility": 0.05, "avg_lifespan_modifier": 1.1 }
      }
    ]
  },

  "event_pool": [
    {
      "id": "evt_border_war",
      "name": "Guerre frontalière",
      "category": "conflict",
      "is_black_swan": false,
      "base_probability": 0.15,
      "preconditions": {
        "requires": "two_adjacent_factions",
        "min_attribute": { "aggressiveness": 0.4 }
      },
      "modifiers": [
        { "condition": "resource_competition", "probability_bonus": 0.15 },
        { "condition": "attacker_aggressiveness_above_0.7", "probability_bonus": 0.1 },
        { "condition": "defender_cohesion_below_0.3", "probability_bonus": 0.1 }
      ],
      "consequences": {
        "winner": { "territory_gain": true, "population_loss": 0.05 },
        "loser": { "territory_loss": true, "population_loss": 0.15, "cohesion": -0.1 }
      }
    },
    {
      "id": "evt_trade_alliance",
      "name": "Alliance commerciale",
      "category": "diplomacy",
      "is_black_swan": false,
      "base_probability": 0.12,
      "preconditions": {
        "requires": "two_adjacent_factions",
        "min_attribute": { "cohesion": 0.4 }
      },
      "modifiers": [
        { "condition": "shared_resource_need", "probability_bonus": 0.1 },
        { "condition": "both_low_aggressiveness", "probability_bonus": 0.1 }
      ],
      "consequences": {
        "both": { "fertility": 0.05, "cohesion": 0.05, "aggressiveness": -0.05 }
      }
    },
    {
      "id": "evt_succession_crisis",
      "name": "Crise de succession",
      "category": "internal",
      "is_black_swan": false,
      "base_probability": 0.08,
      "preconditions": {
        "requires": "governance_monarchy_or_chieftain"
      },
      "modifiers": [
        { "condition": "cohesion_below_0.4", "probability_bonus": 0.15 },
        { "condition": "leader_death", "probability_bonus": 0.3 }
      ],
      "consequences": {
        "faction": { "cohesion": -0.2, "aggressiveness": 0.1, "civil_war_chance": 0.3 }
      }
    },
    {
      "id": "evt_epidemic",
      "name": "Épidémie",
      "category": "catastrophe",
      "is_black_swan": false,
      "base_probability": 0.06,
      "preconditions": {
        "requires": "population_above_70_percent_capacity"
      },
      "modifiers": [
        { "condition": "no_medicine_tech", "probability_bonus": 0.1 },
        { "condition": "trade_route_active", "probability_bonus": 0.05 }
      ],
      "consequences": {
        "faction": { "population_loss": 0.2, "fertility": -0.1, "cohesion": -0.05 }
      }
    },
    {
      "id": "evt_migration",
      "name": "Vague migratoire",
      "category": "migration",
      "is_black_swan": false,
      "base_probability": 0.07,
      "preconditions": {
        "requires": "faction_in_low_habitability_region"
      },
      "modifiers": [
        { "condition": "famine_active", "probability_bonus": 0.2 },
        { "condition": "war_lost_recently", "probability_bonus": 0.15 }
      ],
      "consequences": {
        "origin": { "population_loss": 0.1 },
        "destination": { "population_gain": 0.1, "cohesion": -0.05 }
      }
    },
    {
      "id": "evt_forced_alliance",
      "name": "Alliance forcée",
      "category": "diplomacy",
      "is_black_swan": false,
      "base_probability": 0.05,
      "preconditions": {
        "requires": "two_adjacent_factions"
      },
      "modifiers": [
        { "condition": "common_threat_active", "probability_bonus": 0.2 }
      ],
      "consequences": {
        "both": { "cohesion": 0.1, "aggressiveness": -0.1 }
      }
    },
    {
      "id": "evt_religious_schism",
      "name": "Schisme religieux",
      "category": "internal",
      "is_black_swan": false,
      "base_probability": 0.05,
      "preconditions": {
        "requires": "governance_theocracy_or_council"
      },
      "modifiers": [
        { "condition": "power_affinity_above_0.6", "probability_bonus": 0.1 },
        { "condition": "multi_region_faction", "probability_bonus": 0.1 }
      ],
      "consequences": {
        "faction": { "cohesion": -0.25, "faction_split_chance": 0.2 }
      }
    },
    {
      "id": "evt_discovery",
      "name": "Découverte majeure",
      "category": "discovery",